author,desc,genre,img,release,score,time,title
Quentin Tarantino,"Après un hold-up manqué, des cambrioleurs de haut vol font leurs comptes dans une confrontation violente, pour découvrir lequel d'entre eux les a trahis.",Policier-Thriller,"data:image/gif;base64,R0lGODlhAwAEAIAAAAAAAAAAACH5BAEAAAAALAAAAAADAAQAAAIDhI9WADs=",12 août 2009,"4,5",1h 39min,Reservoir Dogs
Felix Van Groeningen,"Didier et Élise vivent une histoire d'amour passionnée et rythmée par la musique. Lui, joue du banjo dans un groupe de Bluegrass Country et vénère l'Amérique. Elle, tient un salon de tatouage et chante dans le groupe de Didier. De leur union fusionnelle naît une fille, Maybelle...",Drame,"data:image/gif;base64,R0lGODlhAwAEAIAAAAAAAAAAACH5BAEAAAAALAAAAAADAAQAAAIDhI9WADs=",None,"3,7",1h 49min,Alabama Monroe
Denis Villeneuve,"Dans la banlieue de Boston, deux fillettes de 6 ans, Anna et Joy, ont disparu. Le détective Loki privilégie la thèse du kidnapping suite au témoignage de Keller, le père d’Anna. Le suspect numéro 1 est rapidement arrêté mais est relâché quelques jours plus tard faute de preuve, entrainant la fureur de Keller.",Thriller,"data:image/gif;base64,R0lGODlhAwAEAIAAAAAAAAAAACH5BAEAAAAALAAAAAADAAQAAAIDhI9WADs=",None,"3,8",2h 33min,Prisoners
Max Ophüls,"Vienne 1900. Quelques heures avant l’aube et sur le point d’affronter en duel un adversaire, un mari trompé, qu’il a d’ailleurs l’intention de fuir, Stefan Brand, ex-pianiste célèbre, homme à femmes, reçoit une longue missive d’une inconnue, Lisa Berndle.",Drame-Romance,"data:image/gif;base64,R0lGODlhAwAEAIAAAAAAAAAAACH5BAEAAAAALAAAAAADAAQAAAIDhI9WADs=",9 février 2022,"4,3",1h 27min,Lettre d'une inconnue
Steven Spielberg,"Alors que les forces alliées débarquent à Omaha Beach, Miller doit conduire son escouade derrière les lignes ennemies pour une mission particulièrement dangereuse : trouver et ramener sain et sauf le simple soldat James Ryan, dont les trois frères sont morts au combat en l'espace de trois jours. Pendant que l'escouade progresse en territoire ...",Drame-Guerre,https://fr.web.img6.acsta.net/c_310_420/medias/04/22/53/042253_af.jpg,None,"3,0",2h 43min,Il faut sauver le soldat Ryan
Joseph Kosinski,"Après avoir été l’un des meilleurs pilotes de chasse de la Marine américaine, Pete “Maverick"" Mitchell continue à repousser ses limites en tant que pilote d'essai. Il est chargé de former un détachement de jeunes diplômés de l’école Top Gun pour une mission spéciale qu’aucun pilote n'aurait jamais imaginée.",Action,"data:image/gif;base64,R0lGODlhAwAEAIAAAAAAAAAAACH5BAEAAAAALAAAAAADAAQAAAIDhI9WADs=",None,"3,7",2h 11min,Top Gun: Maverick
None,"1936. L'aventurier Indiana Jones est mandaté pour mettre la main sur le médaillon de Râ, qui serait le premier pas sur le chemin de l'Arche d'Alliance, celle-là même où Moïse conserva les Dix Commandements. Une pièce dont Hitler cherche aussi à s'emparer.",Action-Aventure,"data:image/gif;base64,R0lGODlhAwAEAIAAAAAAAAAAACH5BAEAAAAALAAAAAADAAQAAAIDhI9WADs=",None,"4,6",1h 56min,Les Aventuriers de l'Arche perdue
Lana Wachowski,"Programmeur anonyme, Thomas Anderson est aussi l'un des pirates les plus recherchés du cyber-space. Il est contacté par un certain Morpheus. Ensemble, ils se lancent dans une lutte sans retour contre la Matrice et ses terribles agents...",Action-Science Fiction,"data:image/gif;base64,R0lGODlhAwAEAIAAAAAAAAAAACH5BAEAAAAALAAAAAADAAQAAAIDhI9WADs=",None,"3,4",2h 15min,Matrix
Ridley Scott,"Le vaisseau Nostromo et son équipage rentrent sur Terre avec une cargaison de minerai. Mais lors d'un arrêt forcé sur une planète déserte, l'officier Kane se fait agresser par une forme de vie inconnue, une arachnide qui étouffe son visage...",Epouvante-horreur-Science Fiction,"data:image/gif;base64,R0lGODlhAwAEAIAAAAAAAAAAACH5BAEAAAAALAAAAAADAAQAAAIDhI9WADs=",12 novembre 2003,"4,4",1h 56min,"Alien, le huitième passager"
Robert Zemeckis,"Quelques décennies d'histoire américaine, des années 1940 à la fin du XXème siècle, à travers le regard et l'étrange odyssée d'un homme simple et pur, Forrest Gump.",Comédie-Drame-Romance,https://fr.web.img2.acsta.net/c_310_420/pictures/15/10/13/15/12/514297.jpg,28 octobre 2015,"2,6",2h 20min,Forrest Gump
Gérard Oury,"En 1942, un avion anglais est abattu par les Allemands au-dessus de Paris. Les trois pilotes sautent en parachute et atterrissent dans différents endroits de la capitale.",Comédie,"data:image/gif;base64,R0lGODlhAwAEAIAAAAAAAAAAACH5BAEAAAAALAAAAAADAAQAAAIDhI9WADs=",13 juillet 2016,"3,8",2h 12min,La Grande Vadrouille
Stanley Kubrick,"Écrivain, Jack Torrance est engagé comme gardien, pendant tout l’hiver, d’un grand hôtel isolé du Colorado – l’Overlook – où il espère surmonter enfin sa panne d’inspiration. Il s’y installe avec sa femme Wendy et son fils Danny, doté d’un don de médium.",Epouvante-horreur-Thriller,"data:image/gif;base64,R0lGODlhAwAEAIAAAAAAAAAAACH5BAEAAAAALAAAAAADAAQAAAIDhI9WADs=",22 mai 2019,"4,0",2h 23min,Shining
Alfred Hitchcock,"Le publiciste Roger Tornhill se retrouve par erreur dans la peau d'un espion. Pris entre une mystérieuse organisation qui cherche à le supprimer et la police qui le poursuit, Tornhill est dans une situation bien inconfortable.",Aventure-Policier,"data:image/gif;base64,R0lGODlhAwAEAIAAAAAAAAAAACH5BAEAAAAALAAAAAADAAQAAAIDhI9WADs=",None,"4,6",2h 16min,La Mort aux trousses
Lee Unkrich,"Woody le cowboy, Buzz l'Eclair et les autres jouets se retrouvent confrontés à ce qui devait bien arriver un jour : le départ d'Andy pour l'université...",Aventure-Animation-Comédie,"data:image/gif;base64,R0lGODlhAwAEAIAAAAAAAAAAACH5BAEAAAAALAAAAAADAAQAAAIDhI9WADs=",None,"4,7",1h 40min,Toy Story 3
Isao Takahata,"Kaguya, « la princesse lumineuse », est un petit être découvert dans la tige d’un bambou par un vieux paysan. La considérant comme un don du ciel, il l’élève avec sa femme, et très vite l’enfant devient une magnifique jeune fille. De la campagne lointaine jusqu’à la grande capitale, sa fascinante beauté suscitera l’engouement auprès de tous ceux qui la rencontrent et elle sera convoitée par cinq nobles princes qui devront relever d’impossibles défis dans l’espoir d’obtenir sa main. Mais le temps venu, elle devra affronter son destin…",Animation-Drame-Famille,"data:image/gif;base64,R0lGODlhAwAEAIAAAAAAAAAAACH5BAEAAAAALAAAAAADAAQAAAIDhI9WADs=",None,"4,5",2h 17min,Le Conte de la princesse Kaguya
Alfred Hitchcock,Un reporter immobilisé par un plâtre observe de sa fenêtre les allées et venues de ses voisins. Le comportement bizarre d'un représentant de commerce l'intrigue à un point tel qu'il le croit meurtrier de sa femme. Fantasme ou réalité ?,Policier-Thriller,"data:image/gif;base64,R0lGODlhAwAEAIAAAAAAAAAAACH5BAEAAAAALAAAAAADAAQAAAIDhI9WADs=",22 octobre 2008,"3,9",1h 50min,Fenêtre sur cour
Henri-Georges Clouzot,"Dominique Marceau, une jeune fille provocante, est accusée du meurtre de son ancien amant Gilbert Tellier. Au cours du procès, l'histoire de sa relation avec la victime est reconstituée.",Drame,"data:image/gif;base64,R0lGODlhAwAEAIAAAAAAAAAAACH5BAEAAAAALAAAAAADAAQAAAIDhI9WADs=",8 novembre 2017,"4,9",2h 07min,La Vérité
Steven Spielberg,"Evocation des années de guerre d'Oskar Schindler, industriel autrichien rentré à Cracovie en 1939 avec les troupes allemandes. Il va, tout au long de la guerre, protéger des juifs en les faisant travailler dans sa fabrique.",Historique-Guerre,https://fr.web.img4.acsta.net/c_310_420/pictures/19/03/14/10/37/5927961.jpg,13 mars 2019,"4,2",3h 15min,La Liste de Schindler
Frank Darabont,"Paul Edgecomb, Gardien-chef du pénitencier de Cold Mountain en 1935, était chargé de veiller au bon déroulement des exécutions capitales. Parmi les prisonniers se trouvait un colosse du nom de John Coffey...",Policier-Fantastique,"data:image/gif;base64,R0lGODlhAwAEAIAAAAAAAAAAACH5BAEAAAAALAAAAAADAAQAAAIDhI9WADs=",None,"2,8",3h 09min,La Ligne verte
Sidney Lumet,"Lors d'un procès, un juré émet l'hypothèse que l'homme qu'il doit juger n'est peut-être pas coupable. Il va tenter de convaincre les onze autres jurés.",Drame,"data:image/gif;base64,R0lGODlhAwAEAIAAAAAAAAAAACH5BAEAAAAALAAAAAADAAQAAAIDhI9WADs=",25 juillet 2007,"5,0",1h 35min,12 hommes en colère
Francis Ford Coppola,"En 1945, à New York, les Corleone sont une des cinq familles de la mafia. Don Vito Corleone marie sa fille à un bookmaker. Sollozzo, ""parrain"" de la famille Tattaglia, propose à Don Vito une association dans le trafic de drogue...",Policier-Drame,"data:image/gif;base64,R0lGODlhAwAEAIAAAAAAAAAAACH5BAEAAAAALAAAAAADAAQAAAIDhI9WADs=",23 février 2022,"4,6",2h 55min,Le Parrain
None,"Condamné à perpétuité pour le meurtre de sa femme et de son amant, un banquier s'accroche à l'espoir et se lie d'amitié avec un autre détenu pour survivre en prison.",Drame,"data:image/gif;base64,R0lGODlhAwAEAIAAAAAAAAAAACH5BAEAAAAALAAAAAADAAQAAAIDhI9WADs=",None,"3,2",2h 22min,Les Evadés
Peter Jackson,"Tandis que les ténèbres se répandent sur la Terre du Milieu, Aragorn se révèle être l'héritier caché des rois antiques. Quant à Frodon, toujours tenté par l'Anneau, il voyage à travers les contrées ennemies, se reposant sur Sam et Gollum...",Aventure-Fantastique,"data:image/gif;base64,R0lGODlhAwAEAIAAAAAAAAAAACH5BAEAAAAALAAAAAADAAQAAAIDhI9WADs=",None,"3,8",3h 21min,Le Seigneur des anneaux : le retour du roi
Roger Allers,"Le long combat de Simba le lionceau pour accéder à son rang de roi des animaux, après que le fourbe Scar, son oncle, a tué son père et pris sa place.",Aventure-Animation-Musical,"data:image/gif;base64,R0lGODlhAwAEAIAAAAAAAAAAACH5BAEAAAAALAAAAAADAAQAAAIDhI9WADs=",11 avril 2012,"3,4",1h 29min,Le Roi Lion
Milos Forman,Rebellion dans un hôpital psychiatrique à l'instigation d'un malade qui se révolte contre la dureté d'une infirmière.,Drame,"data:image/gif;base64,R0lGODlhAwAEAIAAAAAAAAAAACH5BAEAAAAALAAAAAADAAQAAAIDhI9WADs=",16 septembre 2009,"5,0",2h 09min,Vol au-dessus d'un nid de coucou
Christopher Nolan,Batman entreprend de démanteler les dernières organisations criminelles de Gotham. Mais il se heurte bientôt à un nouveau génie du crime qui répand la terreur et le chaos dans la ville : le Joker...,Action-Thriller,"data:image/gif;base64,R0lGODlhAwAEAIAAAAAAAAAAACH5BAEAAAAALAAAAAADAAQAAAIDhI9WADs=",None,"4,0",2h 32min,"The Dark Knight, Le Chevalier Noir"
